country_code,country_name,region_name,sub_region_name,official_language,population_value,population_growth_rate,tourism_overview,opportunity_summary,focus_level,headline_metric,map_enabled_flag,display_order,map_x,map_y
US,美国,北美,北美成熟市场,英语,341000000,0.53,入境与本地休闲消费双支撑，航空与主题娱乐带动高频旅游支出。,高客单定制游、主题度假与目的地内容合作空间大。,核心,2025年国际访客消费预计继续恢复至疫前上方,true,1,,
JP,日本,东北亚,东北亚成熟市场,日语,123900000,-0.44,入境复苏强劲，地方旅游、会展及内容型出行持续活跃。,目的地联营产品、二三线城市深度游和会奖旅行有增长空间。,重点,入境消费保持高位，区域机场带动下沉目的地增长,true,2,,
AE,阿联酋,中东,海湾市场,阿拉伯语,10680000,0.97,迪拜和阿布扎比持续强化中转、会展和奢旅目的地属性。,高净值客群服务、商旅会展配套及跨境流量合作值得跟进。,重点,大型会展和航司联动推动全年国际旅客保持高位,true,3,,
FR,法国,欧洲,西欧成熟市场,法语,68400000,0.21,巴黎及核心旅游带稳定吸引长线游客，文化和赛事型出游带动增量。,文化目的地产品、城市通票整合和品牌联名玩法具备空间。,观察,大型活动后续效应仍在释放，城市旅游韧性较强,true,4,,
BR,巴西,拉美,拉美增长市场,葡萄牙语,203100000,0.52,国内旅游和节庆活动带动区域型消费，跨境合作需求增加。,区域分销合作、海岛及节庆线路、拉美多国联游存在机会。,观察,本地节庆带动旅游热度，区域互联航线持续增加,true,5,,
SG,新加坡,东南亚,东南亚枢纽市场,英语,5920000,1.21,航旅枢纽、会展和家庭游产品供给成熟，适合做区域协同。,区域中转产品、主题娱乐、会奖旅行业务延展性强。,重点,樟宜枢纽和会展经济持续拉动高价值旅客流入,true,6,,
