country_code,expo_name,expo_start_date,expo_end_date,expo_quarter,expo_city,expo_note
US,IPW,2026-05-17,2026-05-21,Q2,拉斯维加斯,北美旅游业重要B2B展会，适合对接目的地和分销资源。
JP,Tourism Expo Japan,2026-09-24,2026-09-27,Q3,东京,日本旅业年度重点展会，覆盖目的地、航司和会奖资源。
AE,Arabian Travel Market,2026-05-04,2026-05-07,Q2,迪拜,中东头部旅业展，适合观察中东出入境趋势和渠道资源。
FR,IFTM Top Resa,2026-09-29,2026-10-01,Q3,巴黎,法国旅游行业重要展会，偏欧洲渠道和目的地合作。
BR,WTM Latin America,2026-04-14,2026-04-16,Q2,圣保罗,拉美区域旅业合作展，适合了解区域联游和本地采购侧变化。
SG,ITB Asia,2026-10-21,2026-10-23,Q4,新加坡,亚洲核心旅业展，适合看跨境流量、会奖和技术合作机会。
